<?xml version="1.0" encoding="UTF-8"?>


<!DOCTYPE GARAGES SYSTEM "..\together\garages.dtd">

<GARAGES>
    <GARAGE>
        <NAAM>Garage Westerink B.V.</NAAM>
        <ADRESGEGEVENS>
            <STRAAT>Westeinde</STRAAT>
            <HUISNUMMER>106</HUISNUMMER>
            <POSTCODE>3844 DR</POSTCODE>
            <PLAATS>Harderwijk</PLAATS>
            <PROVINCIE>Gelderland</PROVINCIE>
        </ADRESGEGEVENS>
        <TELEFOONNUMMER>0341 431 188</TELEFOONNUMMER>
        <EMAIL>info@vakgaragewesterink.nl</EMAIL>
        <VERKOOP>
            <OPENINGSTIJDEN>
                <MAANDAG>
                    <OPENINGSTIJDEN>9:00</OPENINGSTIJDEN>
                    <SLUITINGSTIJDEN>18:00</SLUITINGSTIJDEN>
                </MAANDAG>
                <DINSDAG>
                    <OPENINGSTIJDEN>9:00</OPENINGSTIJDEN>
                    <SLUITINGSTIJDEN>18:00</SLUITINGSTIJDEN>
                </DINSDAG>
                <WOENSDAG>
                    <OPENINGSTIJDEN>9:00</OPENINGSTIJDEN>
                    <SLUITINGSTIJDEN>18:00</SLUITINGSTIJDEN>
                </WOENSDAG>
                <DONDERDAG>
                    <OPENINGSTIJDEN>9:00</OPENINGSTIJDEN>
                    <SLUITINGSTIJDEN>18:00</SLUITINGSTIJDEN>
                </DONDERDAG>
                <VRIJDAG>
                    <OPENINGSTIJDEN>9:00</OPENINGSTIJDEN>
                    <SLUITINGSTIJDEN>18:00</SLUITINGSTIJDEN>
                </VRIJDAG>
                <ZATERDAG>
                    <OPENINGSTIJDEN>9:00</OPENINGSTIJDEN>
                    <SLUITINGSTIJDEN>17:00</SLUITINGSTIJDEN>
                </ZATERDAG>
                <ZONDAG>
                    <OPENINGSTIJDEN>Gesloten</OPENINGSTIJDEN>
                    <SLUITINGSTIJDEN>Gesloten</SLUITINGSTIJDEN>
                </ZONDAG>
            </OPENINGSTIJDEN>
            <DIENSTEN>
                <VERHUUR>Nee</VERHUUR>
                <LENEN>Nee</LENEN>
            </DIENSTEN>
            <AUTOS>
                <AUTO kenteken="XX-RR22-12">
                    <NIEUW>Ja</NIEUW>
                    <MERK>MITSUBISHI</MERK>
                    <TYPE>SPACE STAR COOL+</TYPE>
                    <BOUWJAAR>2017</BOUWJAAR>
                    <BRANDSTOF>Diesel</BRANDSTOF>
                    <PRIJS>176</PRIJS>
                    <DATUM>12-02-2015</DATUM>
                    <APK-VERLOOP-DATUM>12-02-2020</APK-VERLOOP-DATUM>
                    <FOTOS>
                        <FOTO>E:\Users\jose_\Desktop\Stenden\jaar 2\periode 3\XML\Space-Star---website-900x900---V3.png</FOTO>
                    </FOTOS>
                </AUTO>
            </AUTOS>
        </VERKOOP>
        <WERKPLAATS>
            <OPENINGSTIJDEN></OPENINGSTIJDEN>
            <WERKZAAMHEDEN>
                <ONDERHOUD></ONDERHOUD>
                <APK></APK>
                <SCHADEHERSTEL></SCHADEHERSTEL>
                <RUITENREPARATIE></RUITENREPARATIE>
                <AIRCOSERVICE></AIRCOSERVICE>
                <BANDENSERVICE></BANDENSERVICE>
            </WERKZAAMHEDEN>
        </WERKPLAATS>
        <CERTIFICATEN></CERTIFICATEN>
        <MEDEWERKERS>
            <MEDEWERKER>
                <VOORNAAM></VOORNAAM>
                <ACHTERNAAM></ACHTERNAAM>
                <FOTO></FOTO>
                <FUNCTIE></FUNCTIE>
            </MEDEWERKER>
        </MEDEWERKERS>
        <FACILITEITEN></FACILITEITEN>
    </GARAGE>
</GARAGES>
