<?xml version="1.0" encoding="UTF-8"?>


<!DOCTYPE GARAGES SYSTEM "..\together\garages.dtd">

<GARAGES>
  <GARAGE>
    <NAAM>Garage de koning</NAAM>
    <ADRESGEGEVENS>
      <STRAAT>Herenstraat</STRAAT>
      <HUISNUMMER>33</HUISNUMMER>
      <POSTCODE>9402XS</POSTCODE>
      <PLAATS>Groningen</PLAATS>
      <PROVINCIE>Groningen</PROVINCIE>
    </ADRESGEGEVENS>
    <TELEFOONNUMMER>0468-686841</TELEFOONNUMMER>
    <EMAIL>contact@garagedeKoning.nl</EMAIL>
    <VERKOOP>
      <OPENINGSTIJDEN>
        <MAANDAG>
          <OPENING>08:00</OPENING>
          <SLUITING>17:30</SLUITING>
        </MAANDAG>
        <DINSDAG>
          <OPENING>08:00</OPENING>
          <SLUITING>17:30</SLUITING>
        </DINSDAG>
        <WOENSDAG>
          <OPENING>08:00</OPENING>
          <SLUITING>17:00</SLUITING>
        </WOENSDAG>
        <DONDERDAG>
          <OPENING>08:00</OPENING>
          <SLUITING>17:00</SLUITING>
        </DONDERDAG>
        <VRIJDAG>
          <OPENING>08:00</OPENING>
          <SLUITING>17:00</SLUITING>
        </VRIJDAG>
        <ZATERDAG>
          <OPENING>10:00</OPENING>
          <SLUITING>16:00</SLUITING>
        </ZATERDAG>
      </OPENINGSTIJDEN>
      <DIENSTEN>
        <VERHUUR>JA</VERHUUR>
        <LENEN>JA</LENEN>
      </DIENSTEN>
      <AUTOS>
        <AUTO kenteken="26-NTT-2">
          <NIEUW>true</NIEUW>
          <MERK>Porsche</MERK>
          <TYPE>Cayenne 2s</TYPE>
          <BOUWJAAR>2018</BOUWJAAR>
          <BRANDSTOF>Diesel</BRANDSTOF>
          <PRIJS>98000,00</PRIJS>
          <DATUM>1-4-2018</DATUM>
          <APK-VERLOOP-DATUM>1-4-2020</APK-VERLOOP-DATUM>
          <FOTOS>
            <FOTO>cayenne2sFront.jpg</FOTO>
            <FOTO>cayenne2sSide.jpg</FOTO>
            <FOTO>cayenne2sPromo.jpg</FOTO>
          </FOTOS>
        </AUTO>
        <AUTO kenteken="99-XDR-4">
          <NIEUW>true</NIEUW>
          <MERK>Audi</MERK>
          <TYPE>A3</TYPE>
          <BOUWJAAR>2018</BOUWJAAR>
          <BRANDSTOF>Benzine</BRANDSTOF>
          <PRIJS>58000,00</PRIJS>
          <DATUM>26-2-2017</DATUM>
          <APK-VERLOOP-DATUM>26-2-2019</APK-VERLOOP-DATUM>
          <FOTOS>
            <FOTO>A3Front.jpg</FOTO>
            <FOTO>A3side.jpg</FOTO>
            <FOTO>A3inside.jpg</FOTO>
          </FOTOS>
      </AUTOS>
    </VERKOOP>
    <WERKPLAATS>
      <OPENINGSTIJDEN>
        <MAANDAG>
          <OPENING>08:00</OPENING>
          <SLUITING>17:30</SLUITING>
        </MAANDAG>
        <DINSDAG>
          <OPENING>08:00</OPENING>
          <SLUITING>17:30</SLUITING>
        </DINSDAG>
        <WOENSDAG>
          <OPENING>08:00</OPENING>
          <SLUITING>17:00</SLUITING>
        </WOENSDAG>
        <DONDERDAG>
          <OPENING>08:00</OPENING>
          <SLUITING>17:00</SLUITING>
        </DONDERDAG>
        <VRIJDAG>
          <OPENING>08:00</OPENING>
          <SLUITING>17:00</SLUITING>
        </VRIJDAG>
        <ZATERDAG>
          <OPENING>10:00</OPENING>
          <SLUITING>16:00</SLUITING>
        </ZATERDAG>
      </OPENINGSTIJDEN>
      <WERKZAAMHEDEN>
        <ONDERHOUD>true</ONDERHOUD>
        <APK>true</APK>
        <SCHADEHERSTEL>false</SCHADEHERSTEL>
        <RUITENREPARATIE>false</RUITENREPARATIE>
        <AIRCOSERVICE>false</AIRCOSERVICE>
        <BANDENSERVICE>true</BANDENSERVICE>
      </WERKZAAMHEDEN>
    </WERKPLAATS>
    <CERTIFICATEN>
      <CERTIFICAAT>BOVAG</CERTIFICAAT>
      <CERTIFICAAT>Bandenspecialist</CERTIFICAAT>
    </CERTIFICATEN>
    <MEDEWERKERS>
      <MEDEWERKER>
        <VOORNAAM>Henry</VOORNAAM>
        <ACHTERNAAM>Ottersma</ACHTERNAAM>
        <FUNCTIE>Bandenvervanger</FUNCTIE>
      </MEDEWERKER>
      <MEDEWERKER>
        <VOORNAAM>Dave</VOORNAAM>
        <ACHTERNAAM>Meesters</ACHTERNAAM>
        <FOTO>Dmeesters.jpg</FOTO>
        <FUNCTIE>Monteur</FUNCTIE>
      </MEDEWERKER>
      <MEDEWERKER>
        <VOORNAAM>Henk</VOORNAAM>
        <ACHTERNAAM>Meesters</ACHTERNAAM>
        <FOTO>Hmeesters.jpg</FOTO>
        <FUNCTIE>Manager</FUNCTIE>
      </MEDEWERKER>
    </MEDEWERKERS>
    <FACILITEITEN>
      <POMPEN>
        <POMP nummer="1">
          <BRANDSTOFFEN>
            <BRANDSTOF>
              <NAAM>Diesel</NAAM>
              <PRIJS>1.31</PRIJS>
            </BRANDSTOF>
            <BRANDSTOF>
              <NAAM>Benzine</NAAM>
              <PRIJS>1.51</PRIJS>
            </BRANDSTOF>
          </BRANDSTOFFEN>
        </POMP>
        <POMP nummer="2">
          <BRANDSTOFFEN>
            <BRANDSTOF>
              <NAAM>Diesel</NAAM>
              <PRIJS>1.31</PRIJS>
            </BRANDSTOF>
            <BRANDSTOF>
              <NAAM>Benzine</NAAM>
              <PRIJS>1.51</PRIJS>
            </BRANDSTOF>
          </BRANDSTOFFEN>
        </POMP>
      </POMPEN>
    </FACILITEITEN>
  </GARAGE>
</GARAGES>
